{
  "$schema": "https://json-schema.org/draft/2020-12/schema",
  "$id": "https://example.org/schemas/ai-trading/manifest.schema.json",
  "title": "AI Trading Pipeline - Run Manifest",
  "type": "object",
  "additionalProperties": false,
  "required": [
    "run_id",
    "created_at_utc",
    "pipeline_version",
    "config_snapshot",
    "dataset",
    "label",
    "window",
    "features",
    "splits",
    "strategy",
    "costs",
    "environment",
    "artifacts"
  ],
  "properties": {
    "run_id": {
      "type": "string",
      "description": "Identifiant unique du run (ex: YYYYMMDD_HHMMSS_<strategy>)."
    },
    "created_at_utc": {
      "type": "string",
      "format": "date-time"
    },
    "pipeline_version": {
      "type": "string"
    },
    "git_commit": {
      "type": "string"
    },
    "config_snapshot": {
      "type": "object",
      "description": "Copie de la configuration utilisée (équivalent du config.yaml)."
    },
    "dataset": {
      "type": "object",
      "additionalProperties": false,
      "required": [
        "exchange",
        "symbols",
        "timeframe",
        "start",
        "end",
        "timezone",
        "raw_files"
      ],
      "properties": {
        "exchange": {
          "type": "string",
          "enum": [
            "binance"
          ]
        },
        "symbols": {
          "type": "array",
          "items": {
            "type": "string"
          },
          "minItems": 1
        },
        "timeframe": {
          "type": "string",
          "description": "Ex: 1h, 15m."
        },
        "start": {
          "type": "string",
          "format": "date"
        },
        "end": {
          "type": "string",
          "format": "date"
        },
        "timezone": {
          "type": "string",
          "description": "Toujours UTC pour ce projet."
        },
        "raw_files": {
          "type": "array",
          "minItems": 1,
          "items": {
            "type": "object",
            "additionalProperties": false,
            "required": [
              "path",
              "sha256",
              "n_rows"
            ],
            "properties": {
              "path": {
                "type": "string"
              },
              "sha256": {
                "type": "string",
                "pattern": "^[a-fA-F0-9]{64}$"
              },
              "n_rows": {
                "type": "integer",
                "minimum": 0
              }
            }
          }
        }
      }
    },
    "label": {
      "type": "object",
      "additionalProperties": false,
      "required": [
        "horizon_H_bars",
        "target_type"
      ],
      "properties": {
        "horizon_H_bars": {
          "type": "integer",
          "minimum": 1
        },
        "target_type": {
          "type": "string",
          "enum": [
            "log_return_trade",
            "log_return_close_to_close"
          ]
        },
        "definition": {
          "type": "string"
        }
      }
    },
    "window": {
      "type": "object",
      "additionalProperties": false,
      "required": [
        "L",
        "min_warmup"
      ],
      "properties": {
        "L": {
          "type": "integer",
          "minimum": 2
        },
        "min_warmup": {
          "type": "integer",
          "minimum": 0
        }
      }
    },
    "features": {
      "type": "object",
      "additionalProperties": false,
      "required": [
        "feature_list",
        "feature_version"
      ],
      "properties": {
        "feature_list": {
          "type": "array",
          "items": {
            "type": "string"
          },
          "minItems": 1
        },
        "feature_version": {
          "type": "string"
        }
      }
    },
    "splits": {
      "type": "object",
      "additionalProperties": false,
      "required": [
        "scheme",
        "train_days",
        "test_days",
        "step_days",
        "val_frac_in_train",
        "embargo_bars",
        "folds"
      ],
      "properties": {
        "scheme": {
          "type": "string",
          "enum": [
            "walk_forward_rolling"
          ]
        },
        "train_days": {
          "type": "integer",
          "minimum": 1
        },
        "test_days": {
          "type": "integer",
          "minimum": 1
        },
        "step_days": {
          "type": "integer",
          "minimum": 1
        },
        "val_frac_in_train": {
          "type": "number",
          "minimum": 0.0,
          "maximum": 0.5
        },
        "embargo_bars": {
          "type": "integer",
          "minimum": 0
        },
        "folds": {
          "type": "array",
          "minItems": 1,
          "items": {
            "type": "object",
            "additionalProperties": false,
            "required": [
              "fold_id",
              "train",
              "val",
              "test"
            ],
            "properties": {
              "fold_id": {
                "type": "integer",
                "minimum": 0
              },
              "train": {
                "$ref": "#/$defs/period"
              },
              "val": {
                "$ref": "#/$defs/period"
              },
              "test": {
                "$ref": "#/$defs/period"
              }
            }
          }
        }
      }
    },
    "strategy": {
      "type": "object",
      "additionalProperties": false,
      "required": [
        "strategy_type",
        "name"
      ],
      "properties": {
        "strategy_type": {
          "type": "string",
          "enum": [
            "model",
            "baseline"
          ]
        },
        "name": {
          "type": "string",
          "description": "Ex: xgboost_reg, cnn1d_reg, gru_reg, lstm_reg, patchtst_reg, rl_ppo, no_trade, buy_hold, sma_rule."
        },
        "framework": {
          "type": "string"
        },
        "hyperparams": {
          "type": "object"
        },
        "thresholding": {
          "type": "object",
          "additionalProperties": false,
          "properties": {
            "method": {
              "type": "string",
              "enum": [
                "quantile_grid",
                "fixed_value",
                "none"
              ]
            },
            "q_grid": {
              "type": "array",
              "items": {
                "type": "number",
                "minimum": 0.0,
                "maximum": 1.0
              }
            },
            "objective": {
              "type": "string"
            },
            "mdd_cap": {
              "type": "number",
              "minimum": 0.0
            },
            "min_trades": {
              "type": "integer",
              "minimum": 0
            }
          }
        }
      }
    },
    "costs": {
      "type": "object",
      "additionalProperties": false,
      "required": [
        "fee_rate_per_side",
        "slippage_rate_per_side",
        "cost_model"
      ],
      "properties": {
        "cost_model": {
          "type": "string",
          "enum": [
            "per_side_multiplicative"
          ]
        },
        "fee_rate_per_side": {
          "type": "number",
          "minimum": 0.0
        },
        "slippage_rate_per_side": {
          "type": "number",
          "minimum": 0.0
        }
      }
    },
    "environment": {
      "type": "object",
      "additionalProperties": false,
      "properties": {
        "python_version": {
          "type": "string"
        },
        "platform": {
          "type": "string"
        },
        "packages": {
          "type": "object",
          "additionalProperties": {
            "type": "string"
          }
        }
      }
    },
    "artifacts": {
      "type": "object",
      "additionalProperties": false,
      "required": [
        "run_dir",
        "files"
      ],
      "properties": {
        "run_dir": {
          "type": "string"
        },
        "files": {
          "type": "object",
          "additionalProperties": false,
          "required": [
            "manifest_json",
            "metrics_json"
          ],
          "properties": {
            "manifest_json": {
              "type": "string"
            },
            "metrics_json": {
              "type": "string"
            },
            "config_yaml": {
              "type": "string"
            },
            "equity_curve_csv": {
              "type": "string"
            },
            "report_html": {
              "type": "string"
            },
            "report_pdf": {
              "type": "string"
            }
          }
        },
        "per_fold": {
          "type": "array",
          "items": {
            "type": "object",
            "additionalProperties": false,
            "required": [
              "fold_id",
              "files"
            ],
            "properties": {
              "fold_id": {
                "type": "integer",
                "minimum": 0
              },
              "files": {
                "type": "object",
                "additionalProperties": false,
                "properties": {
                  "preds_val_csv": {
                    "type": "string"
                  },
                  "preds_test_csv": {
                    "type": "string"
                  },
                  "trades_csv": {
                    "type": "string"
                  },
                  "metrics_fold_json": {
                    "type": "string"
                  },
                  "model_artifacts_dir": {
                    "type": "string"
                  }
                }
              }
            }
          }
        }
      }
    }
  },
  "$defs": {
    "period": {
      "type": "object",
      "additionalProperties": false,
      "required": [
        "start_utc",
        "end_utc"
      ],
      "properties": {
        "start_utc": {
          "type": "string",
          "format": "date-time"
        },
        "end_utc": {
          "type": "string",
          "format": "date-time"
        }
      }
    }
  }
}