{
  "run_id": "20260227_120000_xgboost_reg",
  "created_at_utc": "2026-02-27T12:00:00Z",
  "pipeline_version": "1.0.0",
  "git_commit": "abc123def",
  "config_snapshot": {
    "dataset": {
      "exchange": "binance",
      "symbols": [
        "BTCUSDT"
      ],
      "timeframe": "1h",
      "start": "2024-01-01",
      "end": "2026-01-01",
      "timezone": "UTC"
    },
    "label": {
      "horizon_H_bars": 4,
      "target_type": "log_return_trade"
    },
    "window": {
      "L": 128,
      "min_warmup": 200
    }
  },
  "dataset": {
    "exchange": "binance",
    "symbols": [
      "BTCUSDT"
    ],
    "timeframe": "1h",
    "start": "2024-01-01",
    "end": "2026-01-01",
    "timezone": "UTC",
    "raw_files": [
      {
        "path": "data/raw/BTCUSDT_1h_2024-01-01_2026-01-01.parquet",
        "sha256": "0000000000000000000000000000000000000000000000000000000000000000",
        "n_rows": 17520
      }
    ]
  },
  "label": {
    "horizon_H_bars": 4,
    "target_type": "log_return_trade",
    "definition": "log(Close[t+H]/Open[t+1])"
  },
  "window": {
    "L": 128,
    "min_warmup": 200
  },
  "features": {
    "feature_list": [
      "logret_1",
      "logret_2",
      "logret_4",
      "vol_24",
      "vol_72",
      "logvol",
      "dlogvol",
      "rsi_14",
      "ema_ratio_12_26"
    ],
    "feature_version": "mvp_v1"
  },
  "splits": {
    "scheme": "walk_forward_rolling",
    "train_days": 180,
    "test_days": 30,
    "step_days": 30,
    "val_frac_in_train": 0.2,
    "embargo_bars": 4,
    "folds": [
      {
        "fold_id": 0,
        "train": {
          "start_utc": "2024-01-01T00:00:00Z",
          "end_utc": "2024-05-26T23:00:00Z"
        },
        "val": {
          "start_utc": "2024-05-27T00:00:00Z",
          "end_utc": "2024-06-29T23:00:00Z"
        },
        "test": {
          "start_utc": "2024-07-01T00:00:00Z",
          "end_utc": "2024-07-30T23:00:00Z"
        }
      }
    ]
  },
  "strategy": {
    "strategy_type": "model",
    "name": "xgboost_reg",
    "framework": "xgboost",
    "hyperparams": {
      "max_depth": 5,
      "n_estimators": 500,
      "learning_rate": 0.05
    },
    "thresholding": {
      "method": "quantile_grid",
      "q_grid": [
        0.5,
        0.6,
        0.7,
        0.8,
        0.9,
        0.95
      ],
      "objective": "max_net_pnl_with_mdd_cap",
      "mdd_cap": 0.25,
      "min_trades": 20
    }
  },
  "costs": {
    "cost_model": "per_side_multiplicative",
    "fee_rate_per_side": 0.0005,
    "slippage_rate_per_side": 0.00025
  },
  "environment": {
    "python_version": "3.11.0",
    "platform": "linux",
    "packages": {
      "numpy": "1.26.0",
      "xgboost": "2.0.0"
    }
  },
  "artifacts": {
    "run_dir": "runs/20260227_120000_xgboost_reg",
    "files": {
      "manifest_json": "manifest.json",
      "metrics_json": "metrics.json",
      "config_yaml": "config_snapshot.yaml"
    },
    "per_fold": [
      {
        "fold_id": 0,
        "files": {
          "preds_val_csv": "folds/fold_00/preds_val.csv",
          "preds_test_csv": "folds/fold_00/preds_test.csv",
          "trades_csv": "folds/fold_00/trades.csv",
          "metrics_fold_json": "folds/fold_00/metrics_fold.json",
          "model_artifacts_dir": "folds/fold_00/model_artifacts/"
        }
      }
    ]
  }
}